date,title,image,link,likes
2023-01-06,La guerra in Ucraina potrebbe far piombare il mondo nella carestia,https://static.nationalgeographic.it/files/styles/image_3200/public/001_gettyimages-1238855471.jpg?w=1600&h=1200,https://www.nationalgeographic.it/ambiente/2022/04/la-guerra-in-ucraina-potrebbe-far-piombare-il-mondo-nella-carestia,0
2023-01-06,LE STORIE STRAZIANTI DEI RIFUGIATI UCRAINI,https://static.nationalgeographic.it/files/styles/image_3200/public/mm969622030100272.jpg?w=1600&h=1200,https://www.nationalgeographic.it/storia-e-civilta/2022/03/le-storie-strazianti-dei-rifugiati-ucraini,0
2023-01-06,Guerra e razzismo: le tragiche storie dei migranti dall’Ucraina discriminati ai confini europei,https://static.nationalgeographic.it/files/styles/image_3200/public/mm989522030401576-copia.jpg?w=1600&h=900,https://www.nationalgeographic.it/storia-e-civilta/2022/03/guerra-e-razzismo-le-tragiche-storie-dei-migranti-dallucraina-discriminati-ai-confini-europei,0
2023-01-06,Anche gli animali sono vittime di guerra: il viaggio della speranza per salvare l’orso Masha in ...,https://static.nationalgeographic.it/files/styles/image_3200/public/jdo_20220321_0221.jpg?w=1600&h=900,https://www.nationalgeographic.it/animali/2022/03/anche-gli-animali-sono-vittime-di-guerra-il-viaggio-della-speranza-per-salvare-lorso-masha-in-ucraina,0
2023-01-06,Guerra in Ucraina: dobbiamo temere la minaccia nucleare russa?,https://static.nationalgeographic.it/files/styles/image_3200/public/ap22034653712658.jpg?w=1600&h=900,https://www.nationalgeographic.it/storia-e-civilta/2022/03/guerra-in-ucraina-dobbiamo-temere-la-minaccia-nucleare-russa,0
2023-01-06,Coronavirus: leggi tutti gli articoli,https://static.nationalgeographic.it/files/styles/image_3200/public/01_vaccine_1208040950_0.jpg?w=1600&h=1200,https://www.nationalgeographic.it/coronavirus,0
2023-01-06,Esistono persone resistenti al COVID‑19?,https://static.nationalgeographic.it/files/styles/image_3200/public/ss22643480.jpg?w=1600&h=900,https://www.nationalgeographic.it/scienza/2022/04/esistono-persone-resistenti-al-covid-19,1
